00:00.0 Host bridge: Intel Corporation 2nd Generation Core Processor Family DRAM Controller (rev 09)
		Subsystem: Hewlett-Packard Company 2nd Generation Core Processor Family DRAM Controller
		Control: I/O- Mem+ BusMaster+ SpecCycle- MemWINV- VGASnoop- ParErr- Stepping- SERR+ FastB2B- DisINTx-
		Status: Cap+ 66MHz- UDF- FastB2B+ ParErr- DEVSEL=fast >TAbort- <TAbort- <MAbort+ >SERR- <PERR- INTx-
		Latency: 0
		Capabilities: <access denied>
		Kernel driver in use: snb_uncore

00:02.0 VGA compatible controller: Intel Corporation 2nd Generation Core Processor Family Integrated Graphics Controller (rev 09) (prog-if 00 [VGA controller])
		DeviceName:  Onboard IGD
		Subsystem: Hewlett-Packard Company 2nd Generation Core Processor Family Integrated Graphics Controller
		Control: I/O+ Mem+ BusMaster+ SpecCycle- MemWINV- VGASnoop- ParErr- Stepping- SERR- FastB2B- DisINTx+
		Status: Cap+ 66MHz- UDF- FastB2B+ ParErr- DEVSEL=fast >TAbort- <TAbort- <MAbort- >SERR- <PERR- INTx-
		Latency: 0
		Interrupt: pin A routed to IRQ 30
		Region 0: Memory at fe000000 (64-bit, non-prefetchable) [size=4M]
		Region 2: Memory at d0000000 (64-bit, prefetchable) [size=256M]
		Region 4: I/O ports at f000 [size=64]
		[virtual] Expansion ROM at 000c0000 [disabled] [size=128K]
		Capabilities: <access denied>
		Kernel driver in use: i915
		Kernel modules: i915

00:16.0 Communication controller: Intel Corporation 6 Series/C200 Series Chipset Family MEI Controller #1 (rev 04)
		Subsystem: Hewlett-Packard Company 6 Series/C200 Series Chipset Family MEI Controller
		Control: I/O- Mem+ BusMaster+ SpecCycle- MemWINV- VGASnoop- ParErr- Stepping- SERR- FastB2B- DisINTx+
		Status: Cap+ 66MHz- UDF- FastB2B- ParErr- DEVSEL=fast >TAbort- <TAbort- <MAbort- >SERR- <PERR- INTx-
		Latency: 0
		Interrupt: pin A routed to IRQ 31
		Region 0: Memory at fe42a000 (64-bit, non-prefetchable) [size=16]
		Capabilities: <access denied>
		Kernel driver in use: mei_me
		Kernel modules: mei_me

00:16.3 Serial controller: Intel Corporation 6 Series/C200 Series Chipset Family KT Controller (rev 04) (prog-if 02 [16550])
		Subsystem: Hewlett-Packard Company 6 Series/C200 Series Chipset Family KT Controller
		Control: I/O+ Mem+ BusMaster- SpecCycle- MemWINV- VGASnoop- ParErr- Stepping- SERR- FastB2B- DisINTx-
		Status: Cap+ 66MHz+ UDF- FastB2B+ ParErr- DEVSEL=fast >TAbort- <TAbort- <MAbort- >SERR- <PERR- INTx-
		Interrupt: pin B routed to IRQ 17
		Region 0: I/O ports at f0e0 [size=8]
		Region 1: Memory at fe429000 (32-bit, non-prefetchable) [size=4K]
		Capabilities: <access denied>
		Kernel driver in use: serial

00:19.0 Ethernet controller: Intel Corporation 82579LM Gigabit Network Connection (Lewisville) (rev 04)
		DeviceName:  Onboard LAN
		Subsystem: Hewlett-Packard Company 82579LM Gigabit Network Connection
		Control: I/O+ Mem+ BusMaster+ SpecCycle- MemWINV- VGASnoop- ParErr- Stepping- SERR+ FastB2B- DisINTx+
		Status: Cap+ 66MHz- UDF- FastB2B- ParErr- DEVSEL=fast >TAbort- <TAbort- <MAbort- >SERR- <PERR- INTx-
		Latency: 0
		Interrupt: pin A routed to IRQ 29
		Region 0: Memory at fe400000 (32-bit, non-prefetchable) [size=128K]
		Region 1: Memory at fe428000 (32-bit, non-prefetchable) [size=4K]
		Region 2: I/O ports at f080 [size=32]
		Capabilities: <access denied>
		Kernel driver in use: e1000e
		Kernel modules: e1000e

00:1a.0 USB controller: Intel Corporation 6 Series/C200 Series Chipset Family USB Enhanced Host Controller #2 (rev 04) (prog-if 20 [EHCI])
		Subsystem: Hewlett-Packard Company 6 Series/C200 Series Chipset Family USB Enhanced Host Controller
		Control: I/O- Mem+ BusMaster+ SpecCycle- MemWINV- VGASnoop- ParErr- Stepping- SERR+ FastB2B- DisINTx-
		Status: Cap+ 66MHz- UDF- FastB2B+ ParErr- DEVSEL=medium >TAbort- <TAbort- <MAbort- >SERR- <PERR- INTx-
		Latency: 0
		Interrupt: pin A routed to IRQ 16
		Region 0: Memory at fe427000 (32-bit, non-prefetchable) [size=1K]
		Capabilities: <access denied>
		Kernel driver in use: ehci-pci

00:1b.0 Audio device: Intel Corporation 6 Series/C200 Series Chipset Family High Definition Audio Controller (rev 04)
		Subsystem: Hewlett-Packard Company 6 Series/C200 Series Chipset Family High Definition Audio Controller
		Control: I/O- Mem+ BusMaster+ SpecCycle- MemWINV- VGASnoop- ParErr- Stepping- SERR+ FastB2B- DisINTx+
		Status: Cap+ 66MHz- UDF- FastB2B- ParErr- DEVSEL=fast >TAbort- <TAbort- <MAbort- >SERR- <PERR- INTx-
		Latency: 0, Cache Line Size: 64 bytes
		Interrupt: pin A routed to IRQ 32
		Region 0: Memory at fe420000 (64-bit, non-prefetchable) [size=16K]
		Capabilities: <access denied>
		Kernel driver in use: snd_hda_intel
		Kernel modules: snd_hda_intel

00:1c.0 PCI bridge: Intel Corporation 6 Series/C200 Series Chipset Family PCI Express Root Port 1 (rev b4) (prog-if 00 [Normal decode])
		Control: I/O+ Mem+ BusMaster+ SpecCycle- MemWINV- VGASnoop- ParErr- Stepping- SERR+ FastB2B- DisINTx+
		Status: Cap+ 66MHz- UDF- FastB2B- ParErr- DEVSEL=fast >TAbort- <TAbort- <MAbort- >SERR- <PERR- INTx-
		Latency: 0, Cache Line Size: 64 bytes
		Interrupt: pin A routed to IRQ 24
		Bus: primary=00, secondary=01, subordinate=01, sec-latency=0
		Secondary status: 66MHz- FastB2B- ParErr- DEVSEL=fast >TAbort- <TAbort- <MAbort+ <SERR- <PERR-
		BridgeCtl: Parity- SERR+ NoISA- VGA- MAbort- >Reset- FastB2B-
		PriDiscTmr- SecDiscTmr- DiscTmrStat- DiscTmrSERREn-
		Capabilities: <access denied>
		Kernel driver in use: pcieport

00:1c.4 PCI bridge: Intel Corporation 6 Series/C200 Series Chipset Family PCI Express Root Port 5 (rev b4) (prog-if 00 [Normal decode])
		Control: I/O+ Mem+ BusMaster+ SpecCycle- MemWINV- VGASnoop- ParErr- Stepping- SERR+ FastB2B- DisINTx+
		Status: Cap+ 66MHz- UDF- FastB2B- ParErr- DEVSEL=fast >TAbort- <TAbort- <MAbort- >SERR- <PERR- INTx-
		Latency: 0, Cache Line Size: 64 bytes
		Interrupt: pin A routed to IRQ 25
		Bus: primary=00, secondary=02, subordinate=02, sec-latency=0
		Secondary status: 66MHz- FastB2B- ParErr- DEVSEL=fast >TAbort- <TAbort- <MAbort+ <SERR- <PERR-
		BridgeCtl: Parity- SERR+ NoISA- VGA- MAbort- >Reset- FastB2B-
		PriDiscTmr- SecDiscTmr- DiscTmrStat- DiscTmrSERREn-
		Capabilities: <access denied>
		Kernel driver in use: pcieport

00:1c.6 PCI bridge: Intel Corporation 6 Series/C200 Series Chipset Family PCI Express Root Port 7 (rev b4) (prog-if 00 [Normal decode])
		Control: I/O+ Mem+ BusMaster+ SpecCycle- MemWINV- VGASnoop- ParErr- Stepping- SERR+ FastB2B- DisINTx+
		Status: Cap+ 66MHz- UDF- FastB2B- ParErr- DEVSEL=fast >TAbort- <TAbort- <MAbort- >SERR- <PERR- INTx-
		Latency: 0, Cache Line Size: 64 bytes
		Interrupt: pin C routed to IRQ 26
		Bus: primary=00, secondary=03, subordinate=03, sec-latency=0
		Secondary status: 66MHz- FastB2B- ParErr- DEVSEL=fast >TAbort- <TAbort- <MAbort+ <SERR- <PERR-
		BridgeCtl: Parity- SERR+ NoISA- VGA- MAbort- >Reset- FastB2B-
		PriDiscTmr- SecDiscTmr- DiscTmrStat- DiscTmrSERREn-
		Capabilities: <access denied>
		Kernel driver in use: pcieport

00:1c.7 PCI bridge: Intel Corporation 6 Series/C200 Series Chipset Family PCI Express Root Port 8 (rev b4) (prog-if 00 [Normal decode])
		Control: I/O+ Mem+ BusMaster+ SpecCycle- MemWINV- VGASnoop- ParErr- Stepping- SERR+ FastB2B- DisINTx+
		Status: Cap+ 66MHz- UDF- FastB2B- ParErr- DEVSEL=fast >TAbort- <TAbort- <MAbort- >SERR- <PERR- INTx-
		Latency: 0, Cache Line Size: 64 bytes
		Interrupt: pin D routed to IRQ 27
		Bus: primary=00, secondary=04, subordinate=04, sec-latency=0
		Secondary status: 66MHz- FastB2B- ParErr- DEVSEL=fast >TAbort- <TAbort- <MAbort+ <SERR- <PERR-
		BridgeCtl: Parity- SERR+ NoISA- VGA- MAbort- >Reset- FastB2B-
		PriDiscTmr- SecDiscTmr- DiscTmrStat- DiscTmrSERREn-
		Capabilities: <access denied>
		Kernel driver in use: pcieport

00:1d.0 USB controller: Intel Corporation 6 Series/C200 Series Chipset Family USB Enhanced Host Controller #1 (rev 04) (prog-if 20 [EHCI])
		Subsystem: Hewlett-Packard Company 6 Series/C200 Series Chipset Family USB Enhanced Host Controller
		Control: I/O- Mem+ BusMaster+ SpecCycle- MemWINV- VGASnoop- ParErr- Stepping- SERR+ FastB2B- DisINTx-
		Status: Cap+ 66MHz- UDF- FastB2B+ ParErr- DEVSEL=medium >TAbort- <TAbort- <MAbort- >SERR- <PERR- INTx-
		Latency: 0
		Interrupt: pin A routed to IRQ 23
		Region 0: Memory at fe426000 (32-bit, non-prefetchable) [size=1K]
		Capabilities: <access denied>
		Kernel driver in use: ehci-pci

00:1e.0 PCI bridge: Intel Corporation 82801 PCI Bridge (rev a4) (prog-if 01 [Subtractive decode])
		Control: I/O+ Mem+ BusMaster+ SpecCycle- MemWINV- VGASnoop- ParErr- Stepping- SERR+ FastB2B- DisINTx-
		Status: Cap+ 66MHz- UDF- FastB2B- ParErr- DEVSEL=fast >TAbort- <TAbort- <MAbort- >SERR- <PERR- INTx-
		Latency: 0
		Bus: primary=00, secondary=05, subordinate=05, sec-latency=32
		Secondary status: 66MHz- FastB2B+ ParErr- DEVSEL=medium >TAbort- <TAbort- <MAbort+ <SERR- <PERR-
		BridgeCtl: Parity- SERR+ NoISA- VGA- MAbort- >Reset- FastB2B-
		PriDiscTmr- SecDiscTmr- DiscTmrStat- DiscTmrSERREn-
		Capabilities: <access denied>

00:1f.0 ISA bridge: Intel Corporation Q65 Express Chipset LPC Controller (rev 04)
		Subsystem: Hewlett-Packard Company Q65 Express Chipset Family LPC Controller
		Control: I/O+ Mem+ BusMaster+ SpecCycle- MemWINV- VGASnoop- ParErr- Stepping- SERR+ FastB2B- DisINTx-
		Status: Cap+ 66MHz- UDF- FastB2B- ParErr- DEVSEL=medium >TAbort- <TAbort- <MAbort- >SERR- <PERR- INTx-
		Latency: 0
		Capabilities: <access denied>
		Kernel driver in use: lpc_ich
		Kernel modules: lpc_ich

00:1f.2 SATA controller: Intel Corporation 6 Series/C200 Series Chipset Family 6 port Desktop SATA AHCI Controller (rev 04) (prog-if 01 [AHCI 1.0])
		Subsystem: Hewlett-Packard Company 6 Series/C200 Series Chipset Family SATA AHCI Controller
		Control: I/O+ Mem+ BusMaster+ SpecCycle- MemWINV- VGASnoop- ParErr- Stepping- SERR- FastB2B- DisINTx+
		Status: Cap+ 66MHz+ UDF- FastB2B+ ParErr- DEVSEL=medium >TAbort- <TAbort- <MAbort- >SERR- <PERR- INTx-
		Latency: 0
		Interrupt: pin B routed to IRQ 28
		Region 0: I/O ports at f0d0 [size=8]
		Region 1: I/O ports at f0c0 [size=4]
		Region 2: I/O ports at f0b0 [size=8]
		Region 3: I/O ports at f0a0 [size=4]
		Region 4: I/O ports at f060 [size=32]
		Region 5: Memory at fe425000 (32-bit, non-prefetchable) [size=2K]
		Capabilities: <access denied>
		Kernel driver in use: ahci
		Kernel modules: ahci

00:1f.3 SMBus: Intel Corporation 6 Series/C200 Series Chipset Family SMBus Controller (rev 04)
		Subsystem: Hewlett-Packard Company 6 Series/C200 Series Chipset Family SMBus Controller
		Control: I/O+ Mem- BusMaster- SpecCycle- MemWINV- VGASnoop- ParErr- Stepping- SERR+ FastB2B- DisINTx-
		Status: Cap- 66MHz- UDF- FastB2B+ ParErr- DEVSEL=medium >TAbort- <TAbort- <MAbort- >SERR- <PERR- INTx-
		Interrupt: pin C routed to IRQ 10
		Region 0: Memory at fe424000 (64-bit, non-prefetchable) [disabled] [size=256]
		Region 4: I/O ports at f040 [size=32]
		Kernel modules: i2c_i801

